{
  "$schema": "./theme-schema.json",
  "id": "gruvbox-dark",
  "name": "Gruvbox Dark",
  "description": "Retro groove color scheme with warm, earthy tones",
  "background": "#282828",
  "foreground": "#ebdbb2",
  "cursor": "#ebdbb2",
  "cursorAccent": "#282828",
  "selectionBackground": "#504945",
  "ansiColors": {
    "black": "#282828",
    "red": "#cc241d",
    "green": "#98971a",
    "yellow": "#d79921",
    "blue": "#458588",
    "magenta": "#b16286",
    "cyan": "#689d6a",
    "white": "#a89984",
    "brightBlack": "#928374",
    "brightRed": "#fb4934",
    "brightGreen": "#b8bb26",
    "brightYellow": "#fabd2f",
    "brightBlue": "#83a598",
    "brightMagenta": "#d3869b",
    "brightCyan": "#8ec07c",
    "brightWhite": "#ebdbb2"
  }
}
