{
  "$schema": "./theme-schema.json",
  "id": "nord",
  "name": "Nord",
  "description": "Arctic, north-bluish color palette",
  "background": "#2e3440",
  "foreground": "#d8dee9",
  "cursor": "#d8dee9",
  "cursorAccent": "#2e3440",
  "selectionBackground": "#4c566a",
  "ansiColors": {
    "black": "#3b4252",
    "red": "#bf616a",
    "green": "#a3be8c",
    "yellow": "#ebcb8b",
    "blue": "#81a1c1",
    "magenta": "#b48ead",
    "cyan": "#88c0d0",
    "white": "#e5e9f0",
    "brightBlack": "#4c566a",
    "brightRed": "#bf616a",
    "brightGreen": "#a3be8c",
    "brightYellow": "#ebcb8b",
    "brightBlue": "#81a1c1",
    "brightMagenta": "#b48ead",
    "brightCyan": "#8fbcbb",
    "brightWhite": "#eceff4"
  }
}
