{
  "$schema": "./theme-schema.json",
  "id": "catppuccin-mocha",
  "name": "Catppuccin Mocha",
  "description": "Soothing pastel theme for catppuccin lovers",
  "background": "#1e1e2e",
  "foreground": "#cdd6f4",
  "cursor": "#f5e0dc",
  "cursorAccent": "#1e1e2e",
  "selectionBackground": "#585b7066",
  "ansiColors": {
    "black": "#45475a",
    "red": "#f38ba8",
    "green": "#a6e3a1",
    "yellow": "#f9e2af",
    "blue": "#89b4fa",
    "magenta": "#f5c2e7",
    "cyan": "#94e2d5",
    "white": "#bac2de",
    "brightBlack": "#585b70",
    "brightRed": "#f38ba8",
    "brightGreen": "#a6e3a1",
    "brightYellow": "#f9e2af",
    "brightBlue": "#89b4fa",
    "brightMagenta": "#f5c2e7",
    "brightCyan": "#94e2d5",
    "brightWhite": "#a6adc8"
  }
}
